### ISSUE TITLE
[Bug]: HTTPS SSL_new_failed on ESP32 - both in 2.6.4 and 2.6.10

### ISSUE THREAD

**Issue by pleasantone** [meshtastic/firmware#6960]
### Category

WiFi, Hardware Compatibility

### Hardware

T-Beam S3

### Is this bug report about any UI component firmware like InkHUD or Meshtatic UI (MUI)?

- [ ] Meshtastic UI aka MUI colorTFT
- [ ] InkHUD ePaper
- [ ] OLED slide UI on any display

### Firmware Version

2.6.10

### Description

Flash Lilygo T-Beam (ESP32) with either 2.6.4 or 2.6.10.
Include the embedded web ui.
Configure Lora region.
Configure the network.
Reboot
Never see the "setting up SSL keys message" appear after first reboot.

Attempt to go to https://<ip-address> of unit.
Never connects.
Check console logs...

Does not appear on a T-Beam Supreme with 2.6.10 or a Station G2 with 2.6.10 which are both esp32s3, while the t-beam is an esp32 iirc.

```
[HTTPS:I] New connection. Socket FID=52
[HTTPS:E] SSL_new failed. Aborting handshake. FID=52
[HTTPS:I] Connection closed. Socket FID=52
[HTTPS:I] New connection. Socket FID=52
[HTTPS:E] SSL_new failed. Aborting handshake. FID=52
[HTTPS:I] Connection closed. Socket FID=52
```

### Relevant log output

```Shell
[HTTPS:I] New connection. Socket FID=52
[HTTPS:E] SSL_new failed. Aborting handshake. FID=52
[HTTPS:I] Connection closed. Socket FID=52
[HTTPS:I] New connection. Socket FID=52
[HTTPS:E] SSL_new failed. Aborting handshake. FID=52
[HTTPS:I] Connection closed. Socket FID=52
```

**Comment by petraq** [comment]
Same here LILYGO® LoRa32 V2.1_1.6 - tested FW 2.6.11 also 2.7.2

```
INFO  | ??:??:?? 1 Creating the certificate. This may take a while. Please wait
INFO  | ??:??:?? 6 Creating the certificate was successful
DEBUG | ??:??:?? 6 Created Private Key: 1190 Bytes
DEBUG | ??:??:?? 6 Created Certificate: 793 Bytes
INFO  | ??:??:?? 6 SSL Cert Ready!
```

```
[HTTPS:I] New connection. Socket FID=52
[HTTPS:E] SSL setup failed. Aborting handshake. FID=52
[HTTPS:I] Connection closed. Socket FID=52
[HTTPS:I] New connection. Socket FID=52
[HTTPS:E] SSL setup failed. Aborting handshake. FID=52
[HTTPS:I] Connection closed. Socket FID=52
```

```
$ curl -v https://10.0.0.2
*   Trying 10.0.0.2:443...
* Connected to 10.0.0.2 (10.0.0.2) port 443
* ALPN: curl offers h2,http/1.1
* (304) (OUT), TLS handshake, Client hello (1):
*  CAfile: /etc/ssl/cert.pem
*  CApath: none
* Recv failure: Connection reset by peer
* LibreSSL/3.3.6: error:02FFF036:system library:func(4095):Connection reset by peer
* Closing connection
curl: (35) Recv failure: Connection reset by peer
```

**Comment by ftrueck** [comment]
Same on Heltec-v3 nodes. In 2,6.11 the HTTPS output in log is missing via Serial connection but I guess it is the same there.

**Comment by printplaatreparatie** [comment]
T-Beam V1.2 running 2.6.11 also shows problems. Notice the text about missing content in the plain http response.

```
$ curl -v https://192.168.178.84/
*   Trying 192.168.178.84:443...
* Connected to 192.168.178.84 (192.168.178.84) port 443
* ALPN: curl offers h2,http/1.1
* TLSv1.3 (OUT), TLS handshake, Client hello (1):
*  CAfile: /etc/ssl/certs/ca-certificates.crt
*  CApath: /etc/ssl/certs
* Recv failure: Connection reset by peer
* OpenSSL SSL_connect: Connection reset by peer in connection to 192.168.178.84:443
* Closing connection
curl: (35) Recv failure: Connection reset by peer
```

```
$ curl -v http://192.168.178.84/
*   Trying 192.168.178.84:80...
* Connected to 192.168.178.84 (192.168.178.84) port 80
> GET / HTTP/1.1
> Host: 192.168.178.84
> User-Agent: curl/8.5.0
> Accept: */*
>
< HTTP/1.1 200 OK
< Content-Type: text/html
* no chunk, no close, no size. Assume close to signal end
<
Web server is running.<br><br>The content you are looking for can't be found. Please see: <a href=https://meshtastic.org/docs/software/web-client/>FAQ</a>.<br><br><a href=/admin>admin</a>
* Closing connection
```

**Comment by dolvany** [comment]
Some problem here after upgrade to 2.6.11.

* Connected to meshtastic.local (192.168.5.47) port 443
* ALPN: curl offers h2,http/1.1
* (304) (OUT), TLS handshake, Client hello (1):
} [321 bytes data]
* Recv failure: Connection reset by peer

**Comment by Toniolo-Marco** [comment]
Tried both [v2.7.15](https://github.com/meshtastic/firmware/releases/tag/v2.7.15.567b8ea) and [2.7.16](https://github.com/meshtastic/firmware/releases/tag/v2.7.16.a597230) on my T-Beam: neither of them works.

**Comment by cpatulea** [comment]
Running into this on a Heltec v3 with 2.7.15.567b8ea.

meshtastic --info:

```
My info: { "myNodeNum": <snip>, "rebootCount": 252, "minAppVersion": 30200, "deviceId": "<snip>", "pioEnv": "heltec-v3", "nodedbCount": 200, "firmwareEdition": "VANILLA" }
Metadata: { "firmwareVersion": "2.7.15.567b8ea", "deviceStateVersion": 24, "canShutdown": true, "hasWifi": true, "hasBluetooth": true, "positionFlags": 811, "hwModel": "HELTEC_V3", "hasPKC": true, "excludedModules": 1280, "hasEthernet": false, "role": "CLIENT", "hasRemoteHardware": false }
```

```
$ curl -v https://meshtastic/
* Host meshtastic:443 was resolved.
* IPv6: (none)
* IPv4: 192.168.0.14
*   Trying 192.168.0.14:443...
* ALPN: curl offers h2,http/1.1
* TLSv1.3 (OUT), TLS handshake, Client hello (1):
*  CAfile: /etc/ssl/certs/ca-certificates.crt
*  CApath: /etc/ssl/certs
* Recv failure: Connection reset by peer
* TLS connect error: error:00000000:lib(0)::reason(0)
* OpenSSL SSL_connect: Connection reset by peer in connection to meshtastic:443
* closing connection #0
curl: (35) Recv failure: Connection reset by peer
```

Wireshark shows a TLS Client Hello, then ESP kills the connection:

```
1 14:39:09.021  192.168.0.2 192.168.0.14  TCP 74  42534 → 443 [SYN] Seq=0 Win=64240 Len=0 MSS=1460 SACK_PERM TSval=3627888879 TSecr=0 WS=128
2 14:39:09.028  192.168.0.14  192.168.0.2 TCP 60  443 → 42534 [SYN, ACK] Seq=0 Ack=1 Win=5760 Len=0 MSS=1436
3 14:39:09.029  192.168.0.2 192.168.0.14  TCP 54  42534 → 443 [ACK] Seq=1 Ack=1 Win=64240 Len=0
4 14:39:09.034  192.168.0.2 192.168.0.14  TCP 1490  42534 → 443 [ACK] Seq=1 Ack=1 Win=64240 Len=1436 [TCP PDU reassembled in 5]
5 14:39:09.034  192.168.0.2 192.168.0.14  TLSv1.2 188 Client Hello (SNI=meshtastic)
6 14:39:09.038  192.168.0.14  192.168.0.2 TCP 60  443 → 42534 [ACK] Seq=1 Ack=1571 Win=4190 Len=0
7 14:39:09.895  192.168.0.14  192.168.0.2 TCP 60  443 → 42534 [RST, ACK] Seq=1 Ack=1571 Win=32790 Len=0
```

Did a `meshtastic --reboot`, now `curl` works, but Chrome still fails to connect (ERR_CONNECTION_RESET).

Works (curl):
```
Transport Layer Security
    TLSv1.2 Record Layer: Handshake Protocol: Client Hello
        Content Type: Handshake (22)
        Version: TLS 1.0 (0x0301)
        Length: 1571
        Handshake Protocol: Client Hello
            Handshake Type: Client Hello (1)
            Length: 1567
            Version: TLS 1.2 (0x0303)
            Random: d21bac56366a17e34f08381122346d9e472ccaf0d13b4861cd35128bd7530a2e
            Session ID Length: 32
            Session ID: b3af92eaa833877b9951a87a4213e2f3b40d805287fef7c7969c8cedd835c30f
            Cipher Suites Length: 60
            Cipher Suites (30 suites)
            Compression Methods Length: 1
            Compression Methods (1 method)
            Extensions Length: 1434
            Extension: renegotiation_info (len=1)
            Extension: server_name (len=21) name=meshtastic.local
            Extension: ec_point_formats (len=4)
            Extension: supported_groups (len=18)
            Extension: application_layer_protocol_negotiation (len=14)
            Extension: encrypt_then_mac (len=0)
            Extension: extended_master_secret (len=0)
            Extension: post_handshake_auth (len=0)
            Extension: signature_algorithms (len=54)
            Extension: supported_versions (len=5) TLS 1.3, TLS 1.2
            Extension: psk_key_exchange_modes (len=2)
            Extension: key_share (len=1258) X25519MLKEM768, x25519
            Extension: compress_certificate (len=5)
            [JA4: t13d3013h2_1d37bd780c83_8537cf56674e]
            [JA4_r […]: t13d3013h2_002f,0033,0035,0039,003c,003d,0067,006b,009c,009d,009e,009f,1301,1302,1303,c009,c00a,c013,c014,c023,c024,c027,c028,c02b,c02c,c02f,c030,cca8,cca9,ccaa_000a,000b,000d,0016,0017,001b,002b,002d,0031,0033,ff01_0905,0906,]
            [JA3 Fullstring […]: 771,4866-4867-4865-49196-49200-159-52393-52392-52394-49195-49199-158-49188-49192-107-49187-49191-103-49162-49172-57-49161-49171-51-157-156-61-60-53-47,65281-0-11-10-16-22-23-49-13-43-45-51-27,4588-29-23-30-24-25-256-2]
            [JA3: 32e4b8812cda0c0d50783b438492a769]
```

Does not work (Chrome):
```
Transport Layer Security
    TLSv1 Record Layer: Handshake Protocol: Client Hello
        Content Type: Handshake (22)
        Version: TLS 1.0 (0x0301)
        Length: 1785
        Handshake Protocol: Client Hello
            Handshake Type: Client Hello (1)
            Length: 1781
            Version: TLS 1.2 (0x0303)
            Random: a9f7782a1c51526828d460fd661126ca58dfd8c7e3df885ddc0a78fe60963faa
            Session ID Length: 32
            Session ID: d41e64053a38239536233f0f06c01959a6107056db467ae428d25e5d47dcf7d2
            Cipher Suites Length: 32
            Cipher Suites (16 suites)
            Compression Methods Length: 1
            Compression Methods (1 method)
            Extensions Length: 1676
            Extension: Reserved (GREASE) (len=0)
            Extension: supported_versions (len=7) TLS 1.3, TLS 1.2
            Extension: encrypted_client_hello (len=250)
            Extension: Unknown type 17613 (len=5)
            Extension: server_name (len=21) name=meshtastic.local
            Extension: session_ticket (len=0)
            Extension: compress_certificate (len=3)
            Extension: application_layer_protocol_negotiation (len=14)
            Extension: renegotiation_info (len=1)
            Extension: ec_point_formats (len=2)
            Extension: status_request (len=5)
            Extension: signature_algorithms (len=18)
            Extension: key_share (len=1263) X25519MLKEM768, x25519
            Extension: extended_master_secret (len=0)
            Extension: psk_key_exchange_modes (len=2)
            Extension: supported_groups (len=12)
            Extension: signed_certificate_timestamp (len=0)
            Extension: Reserved (GREASE) (len=1)
            [JA4: t13d1516h2_8daaf6152771_d8a2da3f94cd]
            [JA4_r: t13d1516h2_002f,0035,009c,009d,1301,1302,1303,c013,c014,c02b,c02c,c02f,c030,cca8,cca9_0005,000a,000b,000d,0012,0017,001b,0023,002b,002d,0033,44cd,fe0d,ff01_0403,0804,0401,0503,0805,0501,0806,0601]
            [JA3 Fullstring: 771,4865-4866-4867-49195-49199-49196-49200-52393-52392-49171-49172-156-157-47-53,43-65037-17613-0-35-27-16-65281-11-5-13-51-23-45-10-18,4588-29-23-24,0]
            [JA3: 3fcb329bed9c8e35ffc4eb75eaa854af]
```

Works (Firefox):
```
Transport Layer Security
    TLSv1.2 Record Layer: Handshake Protocol: Client Hello
        Content Type: Handshake (22)
        Version: TLS 1.0 (0x0301)
        Length: 1896
        Handshake Protocol: Client Hello
            Handshake Type: Client Hello (1)
            Length: 1892
            Version: TLS 1.2 (0x0303)
            Random: 04300af916ce514982d87b577af459da38e07da2472238572bbd09fa33dd2aaf
            Session ID Length: 32
            Session ID: 5e8e9891a775c60f9169e43bb5a902dc14f471135a7cb40b36f3fcf6290630df
            Cipher Suites Length: 34
            Cipher Suites (17 suites)
            Compression Methods Length: 1
            Compression Methods (1 method)
            Extensions Length: 1785
            Extension: server_name (len=21) name=meshtastic.local
            Extension: extended_master_secret (len=0)
            Extension: renegotiation_info (len=1)
            Extension: supported_groups (len=16)
            Extension: ec_point_formats (len=2)
            Extension: session_ticket (len=0)
            Extension: application_layer_protocol_negotiation (len=14)
            Extension: status_request (len=5)
            Extension: delegated_credentials (len=10)
            Extension: signed_certificate_timestamp (len=0)
            Extension: key_share (len=1327) X25519MLKEM768, x25519, secp256r1
            Extension: supported_versions (len=5) TLS 1.3, TLS 1.2
            Extension: signature_algorithms (len=24)
            Extension: psk_key_exchange_modes (len=2)
            Extension: record_size_limit (len=2)
            Extension: compress_certificate (len=7)
            Extension: encrypted_client_hello (len=281)
            [JA4: t13d1717h2_5b57614c22b0_3cbfd9057e0d]
            [JA4_r: t13d1717h2_002f,0035,009c,009d,1301,1302,1303,c009,c00a,c013,c014,c02b,c02c,c02f,c030,cca8,cca9_0005,000a,000b,000d,0012,0017,001b,001c,0022,0023,002b,002d,0033,fe0d,ff01_0403,0503,0603,0804,0805,0806,0401,0501,0601,0203,0201]
            [JA3 Fullstring: 771,4865-4867-4866-49195-49199-52393-52392-49196-49200-49162-49161-49171-49172-156-157-47-53,0-23-65281-10-11-35-16-5-34-18-51-43-13-45-28-27-65037,4588-29-23-24-25-256-257,0]
            [JA3: 6f7889b9fb1a62a9577e685c1fcfa919]
```

**Comment by cpatulea** [comment]
Now Firefox won't connect anymore either (`Error code: PR_END_OF_FILE_ERROR`).

**Comment by cpatulea** [comment]
Ah, pretty easy to reproduce.

In one terminal, run this command:

```
while :; do curl -k  -v https://meshtastic.local/ ; done
```

and in another terminal:

```
curl -v -k https://meshtastic.local
```

Pretty often, any time two handshakes are happening simultaneously, the second handshake will get:
```
* Recv failure: Connection reset by peer
* LibreSSL/3.3.6: error:02FFF036:system library:func(4095):Connection reset by peer
* Closing connection
curl: (35) Recv failure: Connection reset by peer

```

**Comment by cpatulea** [comment]
Added some debug statements in esp32_https_server/src/HTTPSConnection.cpp, looks like the error code is the following:

```
[HTTPS:E] mbedtls_ssl_setup res=-32512
```

(that's -0x7F00 which is MBEDTLS_ERR_SSL_ALLOC_FAILED and mentioned here: https://github.com/espressif/esp-idf/issues/11854)

**Comment by cpatulea** [comment]
Seems there are esp-idf settings to slim down heap usage:

https://docs.espressif.com/projects/esp-idf/en/latest/esp32/api-reference/protocols/mbedtls.html#reducing-heap-usage

CONFIG_MBEDTLS_SSL_VARIABLE_BUFFER_LENGTH
CONFIG_MBEDTLS_DYNAMIC_BUFFER
CONFIG_MBEDTLS_DYNAMIC_FREE_CONFIG_DATA
CONFIG_MBEDTLS_DYNAMIC_FREE_CA_CERT

but I don't know how to set them from platformio.

**Comment by cpatulea** [comment]
Hacky workaround: run SSL on some other machine on the network, and proxy it to the meshtastic node.

Create self-signed cert: https://news.ycombinator.com/item?id=30487919

Socat proxy: https://simonsafar.com/2021/socat/

```
socat -d -d -d OPENSSL-LISTEN:12347,reuseaddr,cert=socat.pem,key=socat.key,verify=0,fork TCP-CONNECT:meshtastic.local:80
```

**Comment by cpatulea** [comment]
More reliable way to trigger:

```
$ openssl s_client -connect meshtastic.local:443
...
```

(leave connection open)

```
$ curl -v -k https://meshtastic.local/
* Host meshtastic.local:443 was resolved.
* IPv6: (none)
* IPv4: 192.168.0.19
*   Trying 192.168.0.19:443...
* ALPN: curl offers h2,http/1.1
* TLSv1.3 (OUT), TLS handshake, Client hello (1):
* Recv failure: Connection reset by peer
* TLS connect error: error:00000000:lib(0)::reason(0)
* OpenSSL SSL_connect: Connection reset by peer in connection to meshtastic.local:443
* closing connection #0
curl: (35) Recv failure: Connection reset by peer
```

**Comment by cpatulea** [comment]
I guess it's a similar issue as https://medium.com/hackernoon/chrome-preconnect-breaks-singly-threaded-servers-95944be16400 where Chrome opens preconnect aggressively, but the server is not prepared to handle it.

**Comment by cpatulea** [comment]
https://github.com/espressif/esp-idf/blob/master/components/mbedtls/port/dynamic/dynamic_buffer_architecture.md

**Comment by cpatulea** [comment]
Tried part of the esp-idf dynamic memory, just the CONFIG_MBEDTLS_DYNAMIC_FREE_CONFIG_DATA part:

```
    mbedtls_ssl_key_cert *keycert = _ssl.conf->key_cert, *next;;
    while (keycert) {
        next = keycert->next;

        if (keycert) {
            if (keycert->key) {
                mbedtls_pk_free(keycert->key);
                keycert->key = NULL;
            }
            if (keycert->cert) {
                mbedtls_x509_crt_free(keycert->cert);
                keycert->cert = NULL;
            }
            mbedtls_free(keycert);
        }

        keycert = next;
    }
```

that freed about 4 KB, but still not enough to handle two simultaneous connections.

**Comment by cpatulea** [comment]
Running with DEBUG_HEAP to try to find places to reduce heap. Also running a simple text processing script to add the delta heap usage for each log line. My device is a Heltec v3 with Wifi enabled, UDP broadcast, 78 nodes in DB.

Here are the top 10 log lines which consume the most heap:

```
INFO  | ??:??:?? 1 [heap 186676][delta -29232] Loaded /prefs/nodes.proto successfully
INFO  | ??:??:?? 1 [heap 175908][delta -15764] Load /prefs/device.proto
INFO  | ??:??:?? 1 [heap 171776][delta  -4132] Loaded /prefs/device.proto successfully
DEBUG | ??:??:?? 2 [heap 167920][delta  -8488] SPI.begin(SCK=9, MISO=11, MOSI=10, NSS=8)
INFO  | ??:??:?? 2 [heap 163756][delta  -4164] Setting screen RGB color to default: (255,255,128)
DEBUG | ??:??:?? 2 [heap 158380][delta  -5036] Rescan for I2C keyboard
DEBUG | ??:??:?? 2 [heap 138964][delta -12128] Waiting for SSL Cert to be generated
DEBUG | ??:??:?? 2 [heap 93728][delta -43268] JOINING WIFI soon: ssid=HammerTime
INFO  | 01:09:36 25 [heap 84088][delta  -6124] mDNS Host: Meshtastic.local
DEBUG | 01:09:36 26 [heap 68292][delta  -5448] UDP Listening on IP: 192.168.0.19
```

**Comment by cpatulea** [comment]
Some traces of 1 KB+ mallocs:

```
:??:?? 2 [heap 157160] External Notification Module Disabled
[heap trace] size 1024 backtrace:


Backtrace: 0x403756C2:0x3FCEBD80 0x42093021:0x3FCEBDA0 0x40387735:0x3FCEBDC0 0x42074F71:0x3FCEBDE0 0x4201A4FF:0x3FCEC0E0
  #0  0x403756C2 in trace_malloc at :?
  #1  0x42093021 in __wrap_heap_caps_malloc_default at ??:?
  #2  0x40387735 in malloc at /home/runner/work/esp32-arduino-lib-builder/esp32-arduino-lib-builder/esp-idf/components/newlib/heap.c:24
  #3  0x42074F71 in setup() at ??:?
  #4  0x4201A4FF in loopTask(void*) at :?


[heap trace] size 1024 backtrace:


Backtrace: 0x403756C2:0x3FCEBD80 0x42093021:0x3FCEBDA0 0x40387735:0x3FCEBDC0 0x42074F49:0x3FCEBDE0 0x4201A4FF:0x3FCEC0E0
  #0  0x403756C2 in trace_malloc at :?
  #1  0x42093021 in __wrap_heap_caps_malloc_default at ??:?
  #2  0x40387735 in malloc at /home/runner/work/esp32-arduino-lib-builder/esp32-arduino-lib-builder/esp-idf/components/newlib/heap.c:24
  #3  0x42074F49 in setup() at ??:?
  #4  0x4201A4FF in loopTask(void*) at :?


INFO  | ??:??:?? 2 [heap 154136] Applied screen brightness: 153
INFO  | ??:??:?? 2 [heap 154040] Turn on screen
[heap trace] size 4096 backtrace:


Backtrace: 0x403756C2:0x3FCEBC70 0x42093021:0x3FCEBC90 0x40387765:0x3FCEBCB0 0x4214CB0A:0x3FCEBCD0 0x4214E416:0x3FCEBD00 0x4214BBA2:0x3FCEBD20 0x4214BC35:0x3FCEBD60 0x4201309F:0x3FCEBD80 0x4201D2C3:0x3FCEBDA0 0x42090571:0x3FCEBDC0 0x420752A2:0x3FCEBDE0 0x4201A4FF:0x3FCEC0E0
  #0  0x403756C2 in trace_malloc at :?
  #1  0x42093021 in __wrap_heap_caps_malloc_default at ??:?
  #2  0x40387765 in _malloc_r at /home/runner/work/esp32-arduino-lib-builder/esp32-arduino-lib-builder/esp-idf/components/newlib/heap.c:44
  #3  0x4214CB0A in __smakebuf_r at /builds/idf/crosstool-NG/.build/xtensa-esp32s3-elf/src/newlib/newlib/libc/stdio/makebuf.c:53
  #4  0x4214E416 in __srefill_r at /builds/idf/crosstool-NG/.build/xtensa-esp32s3-elf/src/newlib/newlib/libc/stdio/refill.c:96
  #5  0x4214BBA2 in _fread_r at /builds/idf/crosstool-NG/.build/xtensa-esp32s3-elf/src/newlib/newlib/libc/stdio/fread.c:228
  #6  0x4214BC35 in fread at /builds/idf/crosstool-NG/.build/xtensa-esp32s3-elf/src/newlib/newlib/libc/stdio/fread.c:266
  #7  0x4201309F in VFSFileImpl::read(unsigned char*, unsigned int) at :?
  #8  0x4201D2C3 in fs::File::read(unsigned char*, unsigned int) at ??:?
  #9  0x42090571 in fs::File::readBytes(char*, unsigned int) at ??:?
  #10 0x420752A2 in setup() at ??:?
  #11 0x4201A4FF in loopTask(void*) at :?


INFO  | ??:??:?? 2 [heap 153636] MessageStore loaded from flash
...
INFO  | ??:??:?? 3 [heap 151844] SX1262 init success
[heap trace] size 2208 backtrace:


Backtrace: 0x403756C2:0x3FCEBC80 0x42093021:0x3FCEBCA0 0x40387735:0x3FCEBCC0 0x42128A86:0x3FCEBCE0 0x4201923F:0x3FCEBD00 0x42044326:0x3FCEBD20 0x42075875:0x3FCEBDE0 0x4201A4FF:0x3FCEC0E0
  #0  0x403756C2 in trace_malloc at :?
  #1  0x42093021 in __wrap_heap_caps_malloc_default at ??:?
  #2  0x40387735 in malloc at /home/runner/work/esp32-arduino-lib-builder/esp32-arduino-lib-builder/esp-idf/components/newlib/heap.c:24
  #3  0x42128A86 in operator new(unsigned int) at /builds/idf/crosstool-NG/.build/xtensa-esp32s3-elf/src/gcc/libstdc++-v3/libsupc++/new_op.cc:50
  #4  0x4201923F in WiFiClientSecure::WiFiClientSecure() at ??:?
  #5  0x42044326 in MQTT::MQTT(std::unique_ptr<WiFiClient, std::default_delete<WiFiClient> >) at ??:?
  #6  0x42075875 in setup() at ??:?
  #7  0x4201A4FF in loopTask(void*) at :?

INFO  | ??:??:?? 3 [heap 139780] Existing SSL Certificate found!
[heap trace] size 1191 backtrace:


Backtrace: 0x403756C2:0x3FCBF680 0x42093021:0x3FCBF6A0 0x40387735:0x3FCBF6C0 0x42128A86:0x3FCBF6E0 0x42128BDD:0x3FCBF700 0x4206211F:0x3FCBF720
  #0  0x403756C2 in trace_malloc at :?
  #1  0x42093021 in __wrap_heap_caps_malloc_default at ??:?
  #2  0x40387735 in malloc at /home/runner/work/esp32-arduino-lib-builder/esp32-arduino-lib-builder/esp-idf/components/newlib/heap.c:24
  #3  0x42128A86 in operator new(unsigned int) at /builds/idf/crosstool-NG/.build/xtensa-esp32s3-elf/src/gcc/libstdc++-v3/libsupc++/new_op.cc:50
  #4  0x42128BDD in operator new[](unsigned int) at /builds/idf/crosstool-NG/.build/xtensa-esp32s3-elf/src/gcc/libstdc++-v3/libsupc++/new_opv.cc:32
  #5  0x4206211F in _ZL14taskCreateCertPv$lto_priv$2039 at ??:?


DEBUG | ??:??:?? 3 [heap 137732] Retrieved Private Key: 1191 Bytes
DEBUG | ??:??:?? 3 [heap 137732] Retrieved Certificate: 792 Bytes

[heap trace] size 1904 backtrace:


Backtrace: 0x403756C2:0x3FCCF120 0x42093021:0x3FCCF140 0x4038779E:0x3FCCF160 0x403877BC:0x3FCCF180 0x420DE086:0x3FCCF1A0 0x420DE15E:0x3FCCF1D0 0x420AACA3:0x3FCCF1F0 0x42108BFE:0x3FCCF210 0x421093C5:0x3FCCF230 0x42107B9A:0x3FCCF250 0x4215C639:0x3FCCF270
  #0  0x403756C2 in trace_malloc at :?
  #1  0x42093021 in __wrap_heap_caps_malloc_default at ??:?
  #2  0x4038779E in _calloc_r at /home/runner/work/esp32-arduino-lib-builder/esp32-arduino-lib-builder/esp-idf/components/newlib/heap.c:65
  #3  0x403877BC in calloc at /home/runner/work/esp32-arduino-lib-builder/esp32-arduino-lib-builder/esp-idf/components/newlib/heap.c:29
  #4  0x420DE086 in esp_phy_load_cal_and_init at /home/runner/work/esp32-arduino-lib-builder/esp32-arduino-lib-builder/esp-idf/components/esp_phy/src/phy_init.c:692
  #5  0x420DE15E in esp_phy_enable at /home/runner/work/esp32-arduino-lib-builder/esp32-arduino-lib-builder/esp-idf/components/esp_phy/src/phy_init.c:241
  #6  0x420AACA3 in esp_phy_enable_wrapper at /home/runner/work/esp32-arduino-lib-builder/esp32-arduino-lib-builder/esp-idf/components/esp_wifi/esp32s3/esp_adapter.c:746
  #7  0x42108BFE in wifi_hw_start at ??:?
  #8  0x421093C5 in wifi_start_process at ??:?
  #9  0x42107B9A in ieee80211_ioctl_process at ??:?
  #10 0x4215C639 in ppTask at ??:?

INFO  | ??:??:?? 15 [heap 84588] Start NTP time client
[heap trace] size 1460 backtrace:


Backtrace: 0x403756C2:0x3FCC0DA0 0x42093021:0x3FCC0DC0 0x40387735:0x3FCC0DE0 0x42015822:0x3FCC0E00 0x42015A6B:0x3FCC0E50 0x42060E03:0x3FCC0E80 0x42019E2F:0x3FCC0F70
  #0  0x403756C2 in trace_malloc at :?
  #1  0x42093021 in __wrap_heap_caps_malloc_default at ??:?
  #2  0x40387735 in malloc at /home/runner/work/esp32-arduino-lib-builder/esp32-arduino-lib-builder/esp-idf/components/newlib/heap.c:24
  #3  0x42015822 in WiFiUDP::begin(IPAddress, unsigned short) at :?
  #4  0x42015A6B in WiFiUDP::begin(unsigned short) at ??:?
  #5  0x42060E03 in _ZL9WiFiEvent18arduino_event_id_t$lto_priv$2034 at ??:?
  #6  0x42019E2F in _arduino_event_task(void*) at :?


DEBUG | ??:??:?? 15 [heap 82676] Init Web Server
[heap trace] size 1376 backtrace:


Backtrace: 0x403756C2:0x3FCC0E00 0x42093021:0x3FCC0E20 0x40387735:0x3FCC0E40 0x42128A86:0x3FCC0E60 0x420611CB:0x3FCC0E80 0x42019E2F:0x3FCC0F70
  #0  0x403756C2 in trace_malloc at :?
  #1  0x42093021 in __wrap_heap_caps_malloc_default at ??:?
  #2  0x40387735 in malloc at /home/runner/work/esp32-arduino-lib-builder/esp32-arduino-lib-builder/esp-idf/components/newlib/heap.c:24
  #3  0x42128A86 in operator new(unsigned int) at /builds/idf/crosstool-NG/.build/xtensa-esp32s3-elf/src/gcc/libstdc++-v3/libsupc++/new_op.cc:50
  #4  0x420611CB in _ZL9WiFiEvent18arduino_event_id_t$lto_priv$2034 at ??:?
  #5  0x42019E2F in _arduino_event_task(void*) at :?

DEBUG | ??:??:?? 15 [WifiConnect] [heap 69252] Update NTP time from meshtastic.pool.ntp.org
[heap trace] size 1460 backtrace:


Backtrace: 0x403756C2:0x3FCEBF70 0x42093021:0x3FCEBF90 0x40387735:0x3FCEBFB0 0x42015503:0x3FCEBFD0 0x4205D76E:0x3FCEC010 0x4206FDC1:0x3FCEC040 0x42091D70:0x3FCEC060 0x420725A1:0x3FCEC090 0x4201A511:0x3FCEC0E0
  #0  0x403756C2 in trace_malloc at :?
  #1  0x42093021 in __wrap_heap_caps_malloc_default at ??:?
  #2  0x40387735 in malloc at /home/runner/work/esp32-arduino-lib-builder/esp32-arduino-lib-builder/esp-idf/components/newlib/heap.c:24
  #3  0x42015503 in WiFiUDP::parsePacket() at ??:?
  #4  0x4205D76E in _ZL13reconnectWiFiv$lto_priv$2037 at ??:?
  #5  0x4206FDC1 in concurrency::Periodic::runOnce() at :?
  #6  0x42091D70 in concurrency::OSThread::run() at ??:?
  #7  0x420725A1 in loop() at ??:?
  #8  0x4201A511 in loopTask(void*) at :?


[heap trace] size 1460 backtrace:


Backtrace: 0x403756C2:0x3FCEBF70 0x42093021:0x3FCEBF90 0x40387735:0x3FCEBFB0 0x42015503:0x3FCEBFD0 0x4205D7D5:0x3FCEC010 0x4206FDC1:0x3FCEC040 0x42091D70:0x3FCEC060 0x420725A1:0x3FCEC090 0x4201A511:0x3FCEC0E0
  #0  0x403756C2 in trace_malloc at :?
  #1  0x42093021 in __wrap_heap_caps_malloc_default at ??:?
  #2  0x40387735 in malloc at /home/runner/work/esp32-arduino-lib-builder/esp32-arduino-lib-builder/esp-idf/components/newlib/heap.c:24
  #3  0x42015503 in WiFiUDP::parsePacket() at ??:?
  #4  0x4205D7D5 in _ZL13reconnectWiFiv$lto_priv$2037 at ??:?
  #5  0x4206FDC1 in concurrency::Periodic::runOnce() at :?
  #6  0x42091D70 in concurrency::OSThread::run() at ??:?
  #7  0x420725A1 in loop() at ??:?
  #8  0x4201A511 in loopTask(void*) at :?

...
```

**Comment by cpatulea** [comment]
Note: it appears necessary to disable `-flto` to get line numbers.

```
eap 176208] Packet History - Invalid size -1, using default 400
[heap trace] size 8000 backtrace:


Backtrace: 0x4037560C:0x3FCEBEE0 0x420040D5:0x3FCEBF00 0x403877ED:0x3FCEBF20 0x42139FB2:0x3FCEBF40 0x4213A109:0x3FCEBF60 0x42031377:0x3FCEBF80 0x42035571:0x3FCEBFA0 0x4202B8D5:0x3FCEBFC0 0x4202E211:0x3FCEBFE0 0x4202A462:0x3FCEC000 0x420A3916:0x3FCEC0E0
  #0  0x4037560C in trace_malloc at src/DebugConfiguration.cpp:139
  #1  0x420040D5 in __wrap_heap_caps_malloc_default at src/DebugConfiguration.cpp:162
  #2  0x403877ED in malloc at /home/runner/work/esp32-arduino-lib-builder/esp32-arduino-lib-builder/esp-idf/components/newlib/heap.c:24
  #3  0x42139FB2 in operator new(unsigned int) at /builds/idf/crosstool-NG/.build/xtensa-esp32s3-elf/src/gcc/libstdc++-v3/libsupc++/new_op.cc:50
  #4  0x4213A109 in operator new[](unsigned int) at /builds/idf/crosstool-NG/.build/xtensa-esp32s3-elf/src/gcc/libstdc++-v3/libsupc++/new_opv.cc:32
  #5  0x42031377 in PacketHistory::PacketHistory(unsigned int) at src/mesh/PacketHistory.cpp:28 (discriminator 1)
  #6  0x42035571 in Router::Router() at src/mesh/Router.cpp:66
  #7  0x4202B8D5 in FloodingRouter::FloodingRouter() at src/mesh/FloodingRouter.cpp:12
  #8  0x4202E211 in NextHopRouter::NextHopRouter() at src/mesh/NextHopRouter.cpp:9
  #9  0x4202A462 in ReliableRouter::ReliableRouter() at src/mesh/ReliableRouter.h:8 (discriminator 3)
      (inlined by) setup() at src/mesh/ReliableRouter.h:8 (discriminator 3)
  #10 0x420A3916 in loopTask(void*) at /home/<snip>/.platformio/packages/framework-arduinoespressif32/cores/esp32/main.cpp:42


DEBUG | ??:??:?? 2 [heap 167720] SPI.begin(SCK=9, MISO=11, MOSI=10, NSS=8)
[heap trace] size 3252 backtrace:


Backtrace: 0x4037560C:0x3FCEBF20 0x420040D5:0x3FCEBF40 0x403877ED:0x3FCEBF60 0x42139FB2:0x3FCEBF80 0x4213A109:0x3FCEBFA0 0x4201157D:0x3FCEBFC0 0x4202A649:0x3FCEC000 0x420A3916:0x3FCEC0E0
  #0  0x4037560C in trace_malloc at src/DebugConfiguration.cpp:139
  #1  0x420040D5 in __wrap_heap_caps_malloc_default at src/DebugConfiguration.cpp:162
  #2  0x403877ED in malloc at /home/runner/work/esp32-arduino-lib-builder/esp32-arduino-lib-builder/esp-idf/components/newlib/heap.c:24
  #3  0x42139FB2 in operator new(unsigned int) at /builds/idf/crosstool-NG/.build/xtensa-esp32s3-elf/src/gcc/libstdc++-v3/libsupc++/new_op.cc:50
  #4  0x4213A109 in operator new[](unsigned int) at /builds/idf/crosstool-NG/.build/xtensa-esp32s3-elf/src/gcc/libstdc++-v3/libsupc++/new_opv.cc:32
  #5  0x4201157D in graphics::Screen::Screen(ScanI2C::DeviceAddress, _meshtastic_Config_DisplayConfig_OledType, OLEDDISPLAY_GEOMETRY) at src/graphics/Screen.cpp:309
  #6  0x4202A649 in setup() at src/main.cpp:920
  #7  0x420A3916 in loopTask(void*) at /home/<snip>/.platformio/packages/framework-arduinoespressif32/cores/esp32/main.cpp:42


INFO  | ??:??:?? 2 [heap 163556] Setting screen RGB color to default: (255,255,128)
...
DEBUG | ??:??:?? 2 [heap 158012] Scan address 0x5f
[heap trace] size 1264 backtrace:


Backtrace: 0x4037560C:0x3FCEBF50 0x420040D5:0x3FCEBF70 0x403877ED:0x3FCEBF90 0x42139FB2:0x3FCEBFB0 0x4204A911:0x3FCEBFD0 0x4202A833:0x3FCEC000 0x420A3916:0x3FCEC0E0
  #0  0x4037560C in trace_malloc at src/DebugConfiguration.cpp:139
  #1  0x420040D5 in __wrap_heap_caps_malloc_default at src/DebugConfiguration.cpp:162
  #2  0x403877ED in malloc at /home/runner/work/esp32-arduino-lib-builder/esp32-arduino-lib-builder/esp-idf/components/newlib/heap.c:24
  #3  0x42139FB2 in operator new(unsigned int) at /builds/idf/crosstool-NG/.build/xtensa-esp32s3-elf/src/gcc/libstdc++-v3/libsupc++/new_op.cc:50
  #4  0x4204A911 in setupModules() at src/modules/Modules.cpp:241
  #5  0x4202A833 in setup() at src/main.cpp:988
  #6  0x420A3916 in loopTask(void*) at /home/<snip>/.platformio/packages/framework-arduinoespressif32/cores/esp32/main.cpp:42


[  3016][E][vfs_api.cpp:105] open(): /littlefs/prefs/cannedConf.proto does not exist, no permits for creation
ERROR | ??:??:?? 3 [heap 156752] Could not open / read /prefs/cannedConf.proto
INFO  | ??:??:?? 3 [heap 156748] CannedMessageModule is enabled
INFO  | ??:??:?? 3 [heap 156208] External Notification Module Disabled
[heap trace] size 1024 backtrace:


Backtrace: 0x4037560C:0x3FCEBF00 0x420040D5:0x3FCEBF20 0x403877ED:0x3FCEBF40 0x420671E6:0x3FCEBF60 0x4206829E:0x3FCEBF80 0x42068485:0x3FCEBFA0 0x420118C9:0x3FCEBFC0 0x4202A9C3:0x3FCEC000 0x420A3916:0x3FCEC0E0
  #0  0x4037560C in trace_malloc at src/DebugConfiguration.cpp:139
  #1  0x420040D5 in __wrap_heap_caps_malloc_default at src/DebugConfiguration.cpp:162
  #2  0x403877ED in malloc at /home/runner/work/esp32-arduino-lib-builder/esp32-arduino-lib-builder/esp-idf/components/newlib/heap.c:24
  #3  0x420671E6 in OLEDDisplay::allocateBuffer() at .pio/libdeps/heltec-v3/ESP8266 and ESP32 OLED driver for SSD1306 displays/src/OLEDDisplay.cpp:75
  #4  0x4206829E in OLEDDisplay::init() at .pio/libdeps/heltec-v3/ESP8266 and ESP32 OLED driver for SSD1306 displays/src/OLEDDisplay.cpp:104
  #5  0x42068485 in OLEDDisplayUi::init() at .pio/libdeps/heltec-v3/ESP8266 and ESP32 OLED driver for SSD1306 displays/src/OLEDDisplayUi.cpp:75
  #6  0x420118C9 in graphics::Screen::setup() at src/graphics/Screen.cpp:588
  #7  0x4202A9C3 in setup() at src/main.cpp:1216
  #8  0x420A3916 in loopTask(void*) at /home/<snip>/.platformio/packages/framework-arduinoespressif32/cores/esp32/main.cpp:42


[heap trace] size 1024 backtrace:


Backtrace: 0x4037560C:0x3FCEBF00 0x420040D5:0x3FCEBF20 0x403877ED:0x3FCEBF40 0x420671C1:0x3FCEBF60 0x4206829E:0x3FCEBF80 0x42068485:0x3FCEBFA0 0x420118C9:0x3FCEBFC0 0x4202A9C3:0x3FCEC000 0x420A3916:0x3FCEC0E0
  #0  0x4037560C in trace_malloc at src/DebugConfiguration.cpp:139
  #1  0x420040D5 in __wrap_heap_caps_malloc_default at src/DebugConfiguration.cpp:162
  #2  0x403877ED in malloc at /home/runner/work/esp32-arduino-lib-builder/esp32-arduino-lib-builder/esp-idf/components/newlib/heap.c:24
  #3  0x420671C1 in OLEDDisplay::allocateBuffer() at .pio/libdeps/heltec-v3/ESP8266 and ESP32 OLED driver for SSD1306 displays/src/OLEDDisplay.cpp:86
      (inlined by) OLEDDisplay::allocateBuffer() at .pio/libdeps/heltec-v3/ESP8266 and ESP32 OLED driver for SSD1306 displays/src/OLEDDisplay.cpp:61
  #4  0x4206829E in OLEDDisplay::init() at .pio/libdeps/heltec-v3/ESP8266 and ESP32 OLED driver for SSD1306 displays/src/OLEDDisplay.cpp:104
  #5  0x42068485 in OLEDDisplayUi::init() at .pio/libdeps/heltec-v3/ESP8266 and ESP32 OLED driver for SSD1306 displays/src/OLEDDisplayUi.cpp:75
  #6  0x420118C9 in graphics::Screen::setup() at src/graphics/Screen.cpp:588
  #7  0x4202A9C3 in setup() at src/main.cpp:1216
  #8  0x420A3916 in loopTask(void*) at /home/<snip>/.platformio/packages/framework-arduinoespressif32/cores/esp32/main.cpp:42


INFO  | ??:??:?? 3 [heap 153184] Applied screen brightness: 153
INFO  | ??:??:?? 3 [heap 153088] Turn on screen
[heap trace] size 4096 backtrace:


Backtrace: 0x4037560C:0x3FCEBD10 0x420040D5:0x3FCEBD30 0x4038781D:0x3FCEBD50 0x4215E34E:0x3FCEBD70 0x4215FC5A:0x3FCEBDA0 0x4215D3E6:0x3FCEBDC0 0x4215D479:0x3FCEBE00 0x421573EB:0x3FCEBE20 0x42096EEF:0x3FCEBE40 0x42006312:0x3FCEBE60 0x42011AEB:0x3FCEBFC0 0x4202A9C3:0x3FCEC000 0x420A3916:0x3FCEC0E0
  #0  0x4037560C in trace_malloc at src/DebugConfiguration.cpp:139
  #1  0x420040D5 in __wrap_heap_caps_malloc_default at src/DebugConfiguration.cpp:162
  #2  0x4038781D in _malloc_r at /home/runner/work/esp32-arduino-lib-builder/esp32-arduino-lib-builder/esp-idf/components/newlib/heap.c:44
  #3  0x4215E34E in __smakebuf_r at /builds/idf/crosstool-NG/.build/xtensa-esp32s3-elf/src/newlib/newlib/libc/stdio/makebuf.c:53
  #4  0x4215FC5A in __srefill_r at /builds/idf/crosstool-NG/.build/xtensa-esp32s3-elf/src/newlib/newlib/libc/stdio/refill.c:96
  #5  0x4215D3E6 in _fread_r at /builds/idf/crosstool-NG/.build/xtensa-esp32s3-elf/src/newlib/newlib/libc/stdio/fread.c:228
  #6  0x4215D479 in fread at /builds/idf/crosstool-NG/.build/xtensa-esp32s3-elf/src/newlib/newlib/libc/stdio/fread.c:266
  #7  0x421573EB in VFSFileImpl::read(unsigned char*, unsigned int) at /home/<snip>/.platformio/packages/framework-arduinoespressif32/libraries/FS/src/vfs_api.cpp:408
  #8  0x42096EEF in fs::File::read(unsigned char*, unsigned int) at /home/<snip>/.platformio/packages/framework-arduinoespressif32/libraries/FS/src/FS.cpp:82
  #9  0x42006312 in fs::File::readBytes(char*, unsigned int) at /home/<snip>/.platformio/packages/framework-arduinoespressif32/libraries/FS/src/FS.h:63
      (inlined by) MessageStore::loadFromFlash() at src/MessageStore.cpp:332
  #10 0x42011AEB in graphics::Screen::setup() at src/graphics/Screen.cpp:701
  #11 0x4202A9C3 in setup() at src/main.cpp:1216
  #12 0x420A3916 in loopTask(void*) at /home/<snip>/.platformio/packages/framework-arduinoespressif32/cores/esp32/main.cpp:42

...
DEBUG | ??:??:?? 31 [WifiConnect] [heap 68280] Update NTP time from meshtastic.pool.ntp.org
[heap trace] size 1460 backtrace:


Backtrace: 0x4037560C:0x3FCEBF20 0x420040D5:0x3FCEBF40 0x403877ED:0x3FCEBF60 0x4209AD11:0x3FCEBF80 0x4206C18A:0x3FCEBFD0 0x4206C252:0x3FCEBFF0 0x4203DD6E:0x3FCEC010 0x42169339:0x3FCEC040 0x420090DF:0x3FCEC060 0x420698C5:0x3FCEC090 0x42029B33:0x3FCEC0C0 0x420A3928:0x3FCEC0E0
  #0  0x4037560C in trace_malloc at src/DebugConfiguration.cpp:139
  #1  0x420040D5 in __wrap_heap_caps_malloc_default at src/DebugConfiguration.cpp:162
  #2  0x403877ED in malloc at /home/runner/work/esp32-arduino-lib-builder/esp32-arduino-lib-builder/esp-idf/components/newlib/heap.c:24
  #3  0x4209AD11 in WiFiUDP::parsePacket() at /home/<snip>/.platformio/packages/framework-arduinoespressif32/libraries/WiFi/src/WiFiUdp.cpp:212
  #4  0x4206C18A in NTPClient::forceUpdate() at .pio/libdeps/heltec-v3/NTPClient/NTPClient.cpp:90
  #5  0x4206C252 in NTPClient::update() at .pio/libdeps/heltec-v3/NTPClient/NTPClient.cpp:124
  #6  0x4203DD6E in reconnectWiFi() at src/mesh/wifi/WiFiAPClient.cpp:204
  #7  0x42169339 in concurrency::Periodic::runOnce() at src/concurrency/Periodic.h:21
  #8  0x420090DF in concurrency::OSThread::run() at src/concurrency/OSThread.cpp:85
  #9  0x420698C5 in ThreadController::runOrDelay() at .pio/libdeps/heltec-v3/ArduinoThread/ThreadController.cpp:59
  #10 0x42029B33 in loop() at src/main.cpp:1665
  #11 0x420A3928 in loopTask(void*) at /home/<snip>/.platformio/packages/framework-arduinoespressif32/cores/esp32/main.cpp:50

```

**Comment by cpatulea** [comment]
Another issue which mentions MBEDTLS_ERR_SSL_ALLOC_FAILED: https://github.com/meshtastic/firmware/issues/6666

**Comment by aidenmitchell** [comment]
Continues to be an issue on 2.7.15 and 2.7.18.

**Comment by cpatulea** [comment]
Flamegraph of heap allocs >= 1 KB, with one TLS connection active:

<img width="1512" height="581" alt="Image" src="https://github.com/user-attachments/assets/464032ed-364d-4eca-8d80-fedf6d17552e" />

@esev for general info :)

**Comment by cpatulea** [comment]
Note that the T-Beam has 8 MB of PSRAM. This means maybe there's a possibility of offloading some heap to PSRAM and free up some for mbedtls.

Heltec v3 does NOT have PSRAM, so the only way to make it work is to completely reduce RAM usage somewhere. This is probably much more difficult.

disclaimer: I'm not a Meshtastic dev, just making some educated guesses.

**Comment by cpatulea** [comment]
If https://github.com/meshtastic/firmware/pull/9122 lands, we'll be switching to pioarduino, which will unlock the "Hybrid Compile Mode (unique pioarduino feature)" which would allow us to set `CONFIG_MBEDTLS_DYNAMIC_BUFFER` etc much more easily.

**Comment by cpatulea** [comment]
Here's a PR for moving most of NodeDB to PSRAM https://github.com/meshtastic/firmware/pull/8097 but it seems off-track

**Comment by cpatulea** [comment]
Flamegraph of static RAM usage:

<img width="1512" height="196" alt="Image" src="https://github.com/user-attachments/assets/73ae59a3-e0cf-48b5-a4be-af7a34e705c7" />

Focus on .dram0.bss:

<img width="1512" height="219" alt="Image" src="https://github.com/user-attachments/assets/03548327-7a4a-470b-a868-efeb8dd21164" />

**Comment by cpatulea** [comment]
Unfortunately, I tried the pioarduino branch, and even with CONFIG_MBEDTLS_SSL_VARIABLE_BUFFER_LENGTH, CONFIG_MBEDTLS_DYNAMIC_BUFFER, etc, I can't seem to establish, even a single TLS connection.

```
DEBUG | 04:44:53 1023 [Power] [heap 62492] [largest 31732] Battery: usbPower=1, isCharging=1, batMv=4455, batPct=100
[HTTPS:I] New connection. Socket FID=52
[HTTPS:I] Cert len:792, apn:http/1.1

[!] alloc failed, size 16717


Backtrace: 0x4204AC9F:0x3FCEC020 0x40375855:0x3FCEC040 0x403759FF:0x3FCEC060 0x42124F5B:0x3FCEC080 0x42122C15:0x3FCEC0A0 0x42114F6A:0x3FCEC0C0 0x420EB4B2:0x3FCEC0E0 0x420EB5D1:0x3FCEC120 0x420EB6A1:0x3FCEC160 0x420EAAF9:0x3FCEC180 0x420117E9:0x3FCEC1A0 0x420118D7:0x3FCEC1D0 0x420159F9:0x3FCEC1F0 0x420616DD:0x3FCEC230 0x42028E92:0x3FCEC250 0x4204CD61:0x3FCEC290 0x42099FA3:0x3FCEC2E0
  #0  0x4204AC9F in setup()::{lambda(unsigned int, unsigned long, char const*)#1}::_FUN(unsigned int, unsigned long, char const*) at :?
  #1  0x40375855 in heap_caps_alloc_failed at /home/catalinp/.platformio/packages/framework-espidf/components/heap/heap_caps.c:52
  #2  0x403759FF in heap_caps_calloc at /home/catalinp/.platformio/packages/framework-espidf/components/heap/heap_caps.c:259
  #3  0x42124F5B in esp_mbedtls_mem_calloc at /home/runner/work/esp32-arduino-lib-builder/esp32-arduino-lib-builder/esp-idf/components/mbedtls/port/esp_mem.c:17
  #4  0x42122C15 in mbedtls_calloc at /home/runner/work/esp32-arduino-lib-builder/esp32-arduino-lib-builder/esp-idf/components/mbedtls/mbedtls/library/platform.c:49
  #5  0x42114F6A in mbedtls_ssl_setup at /home/runner/work/esp32-arduino-lib-builder/esp32-arduino-lib-builder/esp-idf/components/mbedtls/mbedtls/library/ssl_tls.c:1410
  #6  0x420EB266 in esp_create_mbedtls_handle at /home/catalinp/.platformio/packages/framework-espidf/components/esp-tls/esp_tls_mbedtls.c:191
```

Note `[largest 31732]` so I think the heap is pretty fragmented. [edit] Compare to master branch, `DEBUG | 05:50:53 63 [Power] [heap 61116][largest 51188]` so there's less fragmentation.

Out of ideas for now, will have to come back to this another time..

[edit] Hmm, notice that frame `#5` is built from /home/runner/work/ (NOT locally) while frame `#6` is built from /home/catalinp/.platformio/ (locally). And seeing mbedtls_ssl_setup call mbedtls_calloc, it suggests that CONFIG_MBEDTLS_SSL_VARIABLE_BUFFER_LENGTH did not take effect at all!

**Comment by cpatulea** [comment]
other projects struggling with heap free and fragmentation in ESP32 / ESP-IDF / mbedTLS https://github.com/micropython/micropython/issues/8940 :(

[edit] heap usage visualizer: https://apps.kde.org/massif_visualizer/

**Comment by cpatulea** [comment]
Heap profile indicates that NodeDB is the biggest single user of RAM:

<img width="1512" height="518" alt="Image" src="https://github.com/user-attachments/assets/94ac6a4e-1037-4a3c-89af-5b1573136d3f" />

I looked a bit at where the space is used in meshtastic_NodeInfoLite:

```
(gdb) ptype/o _meshtastic_NodeInfoLite
/* offset      |    size */  type = struct _meshtastic_NodeInfoLite {
/*      0      |       4 */    uint32_t num;
/*      4      |       1 */    bool has_user;
/* XXX  3-byte hole      */
/*      8      |     100 */    meshtastic_UserLite user;
/*    108      |       1 */    bool has_position;
/* XXX  3-byte hole      */
/*    112      |      20 */    meshtastic_PositionLite position;
/*    132      |       4 */    float snr;
/*    136      |       4 */    uint32_t last_heard;
/*    140      |       1 */    bool has_device_metrics;
/* XXX  3-byte hole      */
/*    144      |      40 */    meshtastic_DeviceMetrics device_metrics;
/*    184      |       1 */    uint8_t channel;
/*    185      |       1 */    bool via_mqtt;
/*    186      |       1 */    bool has_hops_away;
/*    187      |       1 */    uint8_t hops_away;
/*    188      |       1 */    bool is_favorite;
/*    189      |       1 */    bool is_ignored;
/*    190      |       1 */    uint8_t next_hop;
/* XXX  1-byte hole      */
/*    192      |       4 */    uint32_t bitfield;

                               /* total size (bytes):  196 */
                             }
(gdb) ptype/o meshtastic_UserLite
type = struct _meshtastic_UserLite {
/*      0      |       6 */    pb_byte_t macaddr[6];
/*      6      |      40 */    char long_name[40];
/*     46      |       5 */    char short_name[5];
/* XXX  1-byte hole      */
/*     52      |       4 */    meshtastic_HardwareModel hw_model;
/*     56      |       1 */    bool is_licensed;
/* XXX  3-byte hole      */
/*     60      |       4 */    meshtastic_Config_DeviceConfig_Role role;
/*     64      |      34 */    meshtastic_UserLite_public_key_t public_key;
/*     98      |       1 */    bool has_is_unmessagable;
/*     99      |       1 */    bool is_unmessagable;

                               /* total size (bytes):  100 */
                             }
(gdb) ptype/o meshtastic_DeviceMetrics
type = struct _meshtastic_DeviceMetrics {
/*      0      |       1 */    bool has_battery_level;
/* XXX  3-byte hole      */
/*      4      |       4 */    uint32_t battery_level;
/*      8      |       1 */    bool has_voltage;
/* XXX  3-byte hole      */
/*     12      |       4 */    float voltage;
/*     16      |       1 */    bool has_channel_utilization;
/* XXX  3-byte hole      */
/*     20      |       4 */    float channel_utilization;
/*     24      |       1 */    bool has_air_util_tx;
/* XXX  3-byte hole      */
/*     28      |       4 */    float air_util_tx;
/*     32      |       1 */    bool has_uptime_seconds;
/* XXX  3-byte hole      */
/*     36      |       4 */    uint32_t uptime_seconds;

                               /* total size (bytes):   40 */
                             }
```

so there's a bit of waste in padding (around 29 bytes per 196 bytes NodeInfoLite, or around 14%).

I tweaked nanopb options with packed_struct:true for NodeInfoLite, UserLite, DeviceMetrics. That brought NodeDB usage down from ~49 kB to ~41 kB. Total heap usage from ~132 kB to 128 kB. Still not enough to run two TLS connections concurrently.

Struct packing is a easy way to shave ~4 kB of heap usage and might be worth pursuing in general, but it won't actually fix this bug.

**Comment by ftrueck** [comment]
Gosh that memory structure is awful! 
The 3 Byte holes are a complete waste. They are not needed. Since the underlying fields are fixed size you can store them without any padding next to each other. When reading the data the pointer can be moved according to the byte size of the field. Way more efficient and less waste. Second of all: the bool  fields should not waste an entire byte for storing a logical zero or one. That's just insane! is_licensed, has_is_unmessagable, is_unmessagable can be saved with a bitmask in ONE byte field. The remaining fields of device metrics can also be saved in ONE lonely byte field. Simple Bitmask does the trick for all of them. For the char fields: With a bit more effort the fields could be stored padded and \0 can be used as field terminator, which is default in C-Language anyways. Not sure if the settings of nanopb take this into consideration already but if not that's another way to save memory.

**Comment by ftrueck** [comment]
> Still not enough to run two TLS connections concurrently.

In my case I could not even have one TLS connection.

**Comment by ftrueck** [comment]
Doing further considerations:
- has_hops_away is unnecessary if you save hops_away as int8_t and use -1 to indicate that the info is not available
- same for voltage
- same for channel utilization
- same for air_utilization

probably other fields can also be optimized. I did not check them.

Considering my nodeDb contains 200 nodes I can see why RAM is getting full...

**Comment by cpatulea** [comment]
https://developer.espressif.com/blog/esp32-programmers-memory-model/ 

https://developer.espressif.com/blog/esp32-memory-analysis-case-study/

**Comment by cpatulea** [comment]
Possibly another report of this: https://www.reddit.com/r/meshtastic/s/d4rOghVt1d

**Comment by cpatulea** [comment]
Prior work on RAM trimming: https://github.com/meshtastic/firmware/pull/7880#issuecomment-3314927768

**Comment by cpatulea** [comment]
March 2026 PR on ESP32 original to exclude some features (paxcounter, web server) to regain IRAM: https://github.com/meshtastic/firmware/pull/10005

**Comment by cpatulea** [comment]
https://www.reddit.com/r/esp32/s/tReDGwijtP

**Comment by cpatulea** [comment]
This seems to still happen on develop (d4482a28a). Heltec v3, wifi enabled.

First curl works:

```
$ curl -kv https://192.168.0.190
*   Trying 192.168.0.190:443...
* ALPN: curl offers h2,http/1.1
* TLSv1.3 (OUT), TLS handshake, Client hello (1):
* TLSv1.3 (IN), TLS handshake, Server hello (2):
* TLSv1.2 (IN), TLS handshake, Certificate (11):
* TLSv1.2 (IN), TLS handshake, Server key exchange (12):
* TLSv1.2 (IN), TLS handshake, Server finished (14):
...
```

but `openssl s_client` fails:
```
$ openssl s_client -connect 192.168.0.190:443
Connecting to 192.168.0.190
CONNECTED(00000003)
write:errno=104
---
no peer certificate available
---
```

device logs:
```
[HTTPS:I] New connection. Socket FID=52
[HTTPS:I] Request: GET / (FID=52)
WARN  | 04:52:13 24 [WebServer] Low heap (25044 bytes), not accepting HTTPS connections
WARN  | 04:52:13 25 [WebServer] File not available - /static/index.html.gz
[HTTPS:E] An receive error occured, FID=52
[HTTPS:I] Connection closed. Socket FID=52
[HTTPS:I] New connection. Socket FID=52
[HTTPS:E] mbedtls_ssl_setup res=FFFF8100 (SSL - Memory allocation failed)
[HTTPS:E] SSL setup failed. Aborting handshake. FID=52
[HTTPS:I] Connection closed. Socket FID=52
```


and now curl is also broken:

```
$ curl -kv https://192.168.0.190
*   Trying 192.168.0.190:443...
* ALPN: curl offers h2,http/1.1
* TLSv1.3 (OUT), TLS handshake, Client hello (1):
* Recv failure: Connection reset by peer
* TLS connect error: error:00000000:lib(0)::reason(0)
* OpenSSL SSL_connect: Connection reset by peer in connection to 192.168.0.190:443
* closing connection #0
curl: (35) Recv failure: Connection reset by peer
```

**Comment by cpatulea** [comment]
FYI heap profile 

Big heap users are:

- NodeDB (9 kB, this is on a full erase device with LoRa disabled)
- WarmNodeStore (5.8 kB)
- TrafficManagementModule (4.8 kB)
- GeofenceModule (4 kB)
- PacketHistory (3.9 kB)
- 7x system thread stacks (31 kB)

<img width="1512" height="722" alt="Image" src="https://github.com/user-attachments/assets/7d58cf70-8cbd-4cb0-bf04-1b435f41d1e4" />
