### ISSUE TITLE
[Bug]: mqtt not being send (Lilygo T-ETH-Elite)

### ISSUE THREAD

**Issue by chri2** [meshtastic/firmware#6755]
### Category

Other

### Hardware

Other

### Is this bug report about any UI component firmware like InkHUD or Meshtatic UI (MUI)?

- [ ] Meshtastic UI aka MUI colorTFT
- [ ] InkHUD ePaper
- [ ] OLED slide UI on any display

### Firmware Version

tried 2.6.4.b89355f and 2.6.6.54c1423

### Description

A Lilygo T-ETH-Elite flashed including the `--web` feature seems to work on both firmware versions, but **mqtt doesn't send events**.

I'm using the same mqtt server to receive mqtt from a rak4631 and reliably get messages (even though I can't parse the protobuf from the messages and therefor got the ESP32 device to send json).

There's each time I change a mqtt setting a short communication between the device and the broker.

### Relevant log output

```Shell
This is an example tcpdump dump using 2.6.6:


11:10:57.144613 IP 192.168.5.2.53611 > 192.168.6.1.1883: Flags [S], seq 1120608446, win 5760, options [mss 1436], length 0
E..,.t..?............k.[B. .....`...........
11:10:57.144703 IP 192.168.6.1.1883 > 192.168.5.2.53611: Flags [S.], seq 712997141, ack 1120608447, win 14600, options [mss 1460], length 0
E..,..@.@..x.........[.k*.y.B. .`.9..r......
11:10:57.145930 IP 192.168.5.2.53611 > 192.168.6.1.1883: Flags [.], ack 1, win 5760, length 0
E..(.u..?............k.[B. .*.y.P...-...
11:10:57.147280 IP 192.168.5.2.53611 > 192.168.6.1.1883: Flags [P.], seq 1:28, ack 1, win 5760, length 27
E..C.v..?............k.[B. .*.y.P...|.......MQTT.....	!67892810....
11:10:57.147312 IP 192.168.6.1.1883 > 192.168.5.2.53611: Flags [.], ack 28, win 14600, length 0
E..(.F@.@..5.........[.k*.y.B. .P.9..n..
11:10:57.149169 IP 192.168.6.1.1883 > 192.168.5.2.53611: Flags [P.], seq 1:5, ack 28, win 14600, length 4
E..,.G@.@..0.........[.k*.y.B. .P.9..r.. ...
11:10:57.152491 IP 192.168.5.2.53611 > 192.168.6.1.1883: Flags [F.], seq 28, ack 5, win 5756, length 0
E..(.x..?............k.[B. .*.y.P..|,...
11:10:57.152768 IP 192.168.6.1.1883 > 192.168.5.2.53611: Flags [F.], seq 5, ack 29, win 14600, length 0
E..(.H@.@..3.........[.k*.y.B. .P.9..n..
11:10:57.154040 IP 192.168.5.2.53611 > 192.168.6.1.1883: Flags [.], ack 6, win 5755, length 0
E..(.y..?............k.[B. .*.y.P..{,...


The broker (fhem) logs this:


2025.05.06 11:10:24.554 4: Connection accepted from mqtt_server_192.168.5.2_61659
2025.05.06 11:10:24.555 4:   mqtt_server_192.168.5.2_61659 cid:!67892810 CONNECT V:4 keepAlive:15 usr:
2025.05.06 11:10:24.562 4: Connection closed for mqtt_server_192.168.5.2_61659: EOF


The device sends to syslog:


05/06/2025,11:02:47,Info,192.168.5.2,user,1,- NST2_2810 Router - - - ﻿[37]: Save changes to disk
05/06/2025,11:02:47,Info,192.168.5.2,user,1,- NST2_2810 Router - - - ﻿[37]: MQTT connected
05/06/2025,11:02:47,Info,192.168.5.2,user,1,"- NST2_2810 Router - - - ﻿[37]: Connecting directly to MQTT server 192.168.6.1, port: 1883, username: , password: "
05/06/2025,11:02:47,Info,192.168.5.2,user,1,- NST2_2810 Router - - - ﻿[37]: Set module config: MQTT
```

**Comment by chri2** [comment]
If nobody changed anything the problem persists...
